{
  "execution_id": "55555555-5555-4555-8555-555555555555",
  "tenant_id": "11111111-1111-4111-8111-111111111111",
  "project_id": "22222222-2222-4222-8222-222222222222",
  "incident_id": "33333333-3333-4333-8333-333333333333",
  "run_id": "44444444-4444-4444-8444-444444444444",
  "actor_subject": "operator-001",
  "tool": "observability",
  "action": "metrics.query",
  "schema_version": "1.0",
  "resource": "prometheus:synthetic/opsmind-api",
  "arguments": {
    "service": "opsmind-api",
    "metric": "http_errors_total",
    "max_points": 3
  },
  "deadline_at": "2030-01-01T00:00:30Z",
  "result_budget": { "max_bytes": 4096, "max_items": 10 }
}
