{"action":"metrics.query","actor_subject":"77777777-7777-4777-8777-777777777777","arguments":{"max_points":3,"metric":"http_request_duration_seconds","service":"opsmind-api"},"deadline_at":"2030-01-01T00:00:05Z","execution_id":"7ffa1a34-d4ef-82dd-8423-f5945579473e","incident_id":"33333333-3333-4333-8333-333333333333","project_id":"22222222-2222-4222-8222-222222222222","resource":"prometheus:synthetic/opsmind-api","result_budget":{"max_bytes":65536,"max_items":10},"run_id":"44444444-4444-4444-8444-444444444444","schema_version":"1.0","tenant_id":"11111111-1111-4111-8111-111111111111","tool":"observability"}
